<DevCardConfig
        xmlns:xsi="http://www.w3.org/2001/XMLSchema-instance"
        xsi:noNamespaceSchemaLocation="DevCardConfig.xsd">

    <!--DEVCARD-->
    <DevCard>
        <Level>1</Level>
        <Colour>GREEN</Colour>
        <VictoryPoints>1</VictoryPoints>
        <ProductionInput>
            <Resource>
                <Type>COIN</Type>
                <Quantity>1</Quantity>
            </Resource>
        </ProductionInput>
        <ProductionOutput>
            <Resource>
                <Type>FAITHPOINT</Type>
                <Quantity>1</Quantity>
            </Resource>
        </ProductionOutput>
        <Cost>
            <Resource>
                <Type>SHIELD</Type>
                <Quantity>2</Quantity>
            </Resource>
        </Cost>
        <url>url1</url>
    </DevCard>

    <!--DEVCARD-->
    <DevCard>
        <Level>1</Level>
        <Colour>PURPLE</Colour>
        <VictoryPoints>3</VictoryPoints>
        <ProductionInput>
            <Resource>
                <Type>COIN</Type>
                <Quantity>2</Quantity>
            </Resource>
        </ProductionInput>
        <ProductionOutput>
            <Resource>
                <Type>SERVANT</Type>
                <Quantity>1</Quantity>
            </Resource>
            <Resource>
                <Type>SHIELD</Type>
                <Quantity>1</Quantity>
            </Resource>
            <Resource>
                <Type>STONE</Type>
                <Quantity>1</Quantity>
            </Resource>
        </ProductionOutput>
        <Cost>
            <Resource>
                <Type>SERVANT</Type>
                <Quantity>3</Quantity>
            </Resource>
        </Cost>
        <url>url2</url>
    </DevCard>

    <!--DEVCARD-->
    <DevCard>
        <Level>1</Level>
        <Colour>BLUE</Colour>
        <VictoryPoints>3</VictoryPoints>
        <ProductionInput>
            <Resource>
                <Type>STONE</Type>
                <Quantity>2</Quantity>
            </Resource>
        </ProductionInput>
        <ProductionOutput>
            <Resource>
                <Type>COIN</Type>
                <Quantity>1</Quantity>
            </Resource>
            <Resource>
                <Type>SERVANT</Type>
                <Quantity>1</Quantity>
            </Resource>
            <Resource>
                <Type>SHIELD</Type>
                <Quantity>1</Quantity>
            </Resource>
        </ProductionOutput>
        <Cost>
            <Resource>
                <Type>COIN</Type>
                <Quantity>3</Quantity>
            </Resource>
        </Cost>
        <url>url3</url>
    </DevCard>

    <!--DEVCARD-->
    <DevCard>
        <Level>1</Level>
        <Colour>YELLOW</Colour>
        <VictoryPoints>3</VictoryPoints>
        <ProductionInput>
            <Resource>
                <Type>SHIELD</Type>
                <Quantity>2</Quantity>
            </Resource>
        </ProductionInput>
        <ProductionOutput>
            <Resource>
                <Type>COIN</Type>
                <Quantity>1</Quantity>
            </Resource>
            <Resource>
                <Type>SERVANT</Type>
                <Quantity>1</Quantity>
            </Resource>
            <Resource>
                <Type>STONE</Type>
                <Quantity>1</Quantity>
            </Resource>
        </ProductionOutput>
        <Cost>
            <Resource>
                <Type>STONE</Type>
                <Quantity>3</Quantity>
            </Resource>
        </Cost>
        <url>url4</url>
    </DevCard>

    <!--DEVCARD-->
    <DevCard>
        <Level>1</Level>
        <Colour>GREEN</Colour>
        <VictoryPoints>4</VictoryPoints>
        <ProductionInput>
            <Resource>
                <Type>STONE</Type>
                <Quantity>1</Quantity>
            </Resource>
            <Resource>
                <Type>SERVANT</Type>
                <Quantity>1</Quantity>
            </Resource>
        </ProductionInput>
        <ProductionOutput>
            <Resource>
                <Type>COIN</Type>
                <Quantity>2</Quantity>
            </Resource>
            <Resource>
                <Type>FAITHPOINT</Type>
                <Quantity>1</Quantity>
            </Resource>
        </ProductionOutput>
        <Cost>
            <Resource>
                <Type>SHIELD</Type>
                <Quantity>2</Quantity>
            </Resource>
            <Resource>
                <Type>COIN</Type>
                <Quantity>2</Quantity>
            </Resource>
        </Cost>
        <url>url2</url>
    </DevCard>

    <!--DEVCARD-->
    <DevCard>
        <Level>1</Level>
        <Colour>PURPLE</Colour>
        <VictoryPoints>4</VictoryPoints>
        <ProductionInput>
            <Resource>
                <Type>COIN</Type>
                <Quantity>1</Quantity>
            </Resource>
            <Resource>
                <Type>SHIELD</Type>
                <Quantity>1</Quantity>
            </Resource>
        </ProductionInput>
        <ProductionOutput>
            <Resource>
                <Type>STONE</Type>
                <Quantity>2</Quantity>
            </Resource>
            <Resource>
                <Type>FAITHPOINT</Type>
                <Quantity>1</Quantity>
            </Resource>
        </ProductionOutput>
        <Cost>
            <Resource>
                <Type>SERVANT</Type>
                <Quantity>2</Quantity>
            </Resource>
            <Resource>
                <Type>STONE</Type>
                <Quantity>2</Quantity>
            </Resource>
        </Cost>
        <url>url2</url>
    </DevCard>

    <!--DEVCARD-->
    <DevCard>
        <Level>1</Level>
        <Colour>BLUE</Colour>
        <VictoryPoints>4</VictoryPoints>
        <ProductionInput>
            <Resource>
                <Type>SHIELD</Type>
                <Quantity>1</Quantity>
            </Resource>
            <Resource>
                <Type>STONE</Type>
                <Quantity>1</Quantity>
            </Resource>
        </ProductionInput>
        <ProductionOutput>
            <Resource>
                <Type>SERVANT</Type>
                <Quantity>2</Quantity>
            </Resource>
            <Resource>
                <Type>FAITHPOINT</Type>
                <Quantity>1</Quantity>
            </Resource>
        </ProductionOutput>
        <Cost>
            <Resource>
                <Type>COIN</Type>
                <Quantity>2</Quantity>
            </Resource>
            <Resource>
                <Type>SERVANT</Type>
                <Quantity>2</Quantity>
            </Resource>
        </Cost>
        <url>url2</url>
    </DevCard>

    <!--DEVCARD-->
    <DevCard>
        <Level>1</Level>
        <Colour>YELLOW</Colour>
        <VictoryPoints>4</VictoryPoints>
        <ProductionInput>
            <Resource>
                <Type>COIN</Type>
                <Quantity>1</Quantity>
            </Resource>
            <Resource>
                <Type>SERVANT</Type>
                <Quantity>1</Quantity>
            </Resource>
        </ProductionInput>
        <ProductionOutput>
            <Resource>
                <Type>SHIELD</Type>
                <Quantity>2</Quantity>
            </Resource>
            <Resource>
                <Type>FAITHPOINT</Type>
                <Quantity>1</Quantity>
            </Resource>
        </ProductionOutput>
        <Cost>
            <Resource>
                <Type>STONE</Type>
                <Quantity>2</Quantity>
            </Resource>
            <Resource>
                <Type>SHIELD</Type>
                <Quantity>2</Quantity>
            </Resource>
        </Cost>
        <url>url2</url>
    </DevCard>

    <!--DEVCARD-->
    <DevCard>
        <Level>2</Level>
        <Colour>GREEN</Colour>
        <VictoryPoints>5</VictoryPoints>
        <ProductionInput>
            <Resource>
                <Type>STONE</Type>
                <Quantity>1</Quantity>
            </Resource>
        </ProductionInput>
        <ProductionOutput>
            <Resource>
                <Type>FAITHPOINT</Type>
                <Quantity>2</Quantity>
            </Resource>
        </ProductionOutput>
        <Cost>
            <Resource>
                <Type>SHIELD</Type>
                <Quantity>4</Quantity>
            </Resource>
        </Cost>
        <url>url2</url>
    </DevCard>

    <!--DEVCARD-->
    <DevCard>
        <Level>2</Level>
        <Colour>PURPLE</Colour>
        <VictoryPoints>5</VictoryPoints>
        <ProductionInput>
            <Resource>
                <Type>COIN</Type>
                <Quantity>1</Quantity>
            </Resource>
        </ProductionInput>
        <ProductionOutput>
            <Resource>
                <Type>FAITHPOINT</Type>
                <Quantity>2</Quantity>
            </Resource>
        </ProductionOutput>
        <Cost>
            <Resource>
                <Type>SERVANT</Type>
                <Quantity>4</Quantity>
            </Resource>
        </Cost>
        <url>url2</url>
    </DevCard>

    <!--DEVCARD-->
    <DevCard>
        <Level>2</Level>
        <Colour>BLUE</Colour>
        <VictoryPoints>5</VictoryPoints>
        <ProductionInput>
            <Resource>
                <Type>SERVANT</Type>
                <Quantity>1</Quantity>
            </Resource>
        </ProductionInput>
        <ProductionOutput>
            <Resource>
                <Type>FAITHPOINT</Type>
                <Quantity>2</Quantity>
            </Resource>
        </ProductionOutput>
        <Cost>
            <Resource>
                <Type>COIN</Type>
                <Quantity>4</Quantity>
            </Resource>
        </Cost>
        <url>url2</url>
    </DevCard>

    <!--DEVCARD-->
    <DevCard>
        <Level>1</Level>
        <Colour>PURPLE</Colour>
        <VictoryPoints>1</VictoryPoints>
        <ProductionInput>
            <Resource>
                <Type>STONE</Type>